{
    "$schema": "http://json-schema.org/draft-07/schema#",
    "type": "object",
    "required": [
        "recommended_severity",
        "confidence",
        "evidence_ids",
        "justification",
        "policy_compliant",
        "violations"
    ],
    "properties": {
        "recommended_severity": {
            "type": "string",
            "enum": [
                "S1",
                "S2",
                "S3",
                "S4"
            ]
        },
        "confidence": {
            "type": "number",
            "minimum": 0,
            "maximum": 1
        },
        "evidence_ids": {
            "type": "array",
            "items": {
                "type": "string"
            },
            "minItems": 1
        },
        "justification": {
            "type": "string"
        },
        "policy_compliant": {
            "type": "boolean"
        },
        "violations": {
            "type": "array",
            "items": {
                "type": "string"
            }
        }
    },
    "additionalProperties": false
}