{
  "recommended_severity": "S3",
  "confidence": 0.75,
  "evidence_ids": [
    "E1"
  ],
  "justification": "Dashboards are showing stale data per the customer's report (E1). This is a known, non-urgent data-freshness issue expected to resolve on its own; current severity S3 remains appropriate. The billing question raised in the same message is being handled separately through the account team.",
  "policy_compliant": true,
  "violations": []
}